category_id,author,name,description,price,num_buy,amount,sale,star,,,,
4,Adam Khoo,Tôi Tài Giỏi - Bạn Cũng Thế,"Khi bạn cầm trên tay quyển sách này, có nghĩa là bạn đã có chiếc chìa khóa đến sự thành công cùng bảng hướng dẫn sử dụng.

Trong chúng ta, bất kỳ ai cũng muốn chính bản thân mình trở thành người tài giỏi, có thể giải quyết mọi vấn đề một cách hiệu quả nhất. Và để có được những điều đó quyển sách này sẽ giúp bạn bằng những hướng dẫn học tập chi tiết nhất.

Tác giả không chỉ đơn thuần giải thích người khác đã thành công như thế nào, mà còn nói làm sao để họ làm được như thế để giúp người đọc khám phá ra tiềm năng của bản thân, và phát huy điều đó. Ngoài ra, sách còn cung cấp những phương pháp học thông minh (như áp dụng các công cụ học bằng cả não bộ như Sơ Đồ Tư Duy, phát triển trí nhớ siêu việt để ghi nhớ các sự kiện, con số một cách dễ dàng, thành thạo việc quản lý thời gian và xác định mục tiêu). Adam Khoo đã cho thấy, tài giỏi mang lại sự tự tin như thế nào và còn hướng dẫn bạn cách thức trở thành người tài giỏi. Qua đó độc giả sẽ lập được kế hoạch cho cuộc đời của chính mình.

Tôi Tài Giỏi - Bạn Cũng Thế sẽ giúp tìm ra giải pháp tốt nhất cho mọi vấn đề, và giúp nhận ra cách thức để thành công. Tuy nhiên để làm một người tài giỏi thì người đọc cần đặt quyển sách xuống và thực thi ngay các kế hoạch. Đương nhiên, không phải chỉ chăm chỉ ngày một, ngày hai mà mỗi người phải thực hiện lâu dài, thậm chí cả đời thì mới đạt được những gì mình muốn.

Thật sự đây là một quyển sách rất tuyệt vời và bổ ích, đem lại cho chúng ta những kinh nghiệm quý báu. Một quyển sách không - thể - thiếu trong tủ sách!",110000,0,10,74000,5,,,,
7,Kuroyanagi Tetsuko,Totto-Chan Bên Cửa Sổ,"Totto-Chan Bên Cửa Sổ (Tái Bản)

Vừa vào lớp một được vài ngày, Totto-chan đã bị đuổi học!!!

Không còn cách nào khác, mẹ đành đưa Totto-chan đến một ngôi trường mới, trường Tomoe. Đấy là một ngôi trường kỳ lạ, lớp học thì ở trong toa xe điện cũ, học sinh thì được thoả thích thay đổi chỗ ngồi mỗi ngày, muốn học môn nào trước cũng được, chẳng những thế, khi đã học hết bài, các bạn còn được cô giáo cho đi dạo. Đặc biệt hơn ở đó còn có một thầy hiệu trưởng có thể chăm chú lắng nghe Totto-chan kể chuyện suốt bốn tiếng đồng hồ! Chính nhờ ngôi trường đó, một Totto-chan hiếu động, cá biệt đã thu nhận được những điều vô cùng quý giá để lớn lên thành một con người hoàn thiện, mạnh mẽ.

Totto-chan bên cửa sổ, là cuốn sách gối đầu giường của nhiều thế hệ trẻ em trên toàn thế giới suốt ba mươi năm nay. Sau khi xuất bản lần đầu vào năm 1981, cuốn sách đã gây được tiếng vang lớn không chỉ ở Nhật Bản mà còn trên toàn thế giới. Tính đến năm 2001, tổng số bản sách bán ra ở Nhật đã lên đến 9,3 triệu bản, trở thành một trong những cuốn sách bán chạy nhất trong lịch sử ngành xuất bản nước này. Cuốn sách đã được dịch ra 33 thứ tiếng khác nhau, như Anh, Pháp, Đức, Hàn Quốc, Trung Quốc…Khi bản tiếng Anh của Totto-chan được xuất bản tại Mỹ, tờ New York Times đã đăng liền hai bài giới thiệu trọn trang, một “vinh dự” hầu như không tác phẩm nào có được.",80000,0,10,64000,5,,,,
3,Rosie Nguyễn,Tuổi Trẻ Đáng Giá Bao Nhiêu,"Tuổi Trẻ Đáng Giá Bao Nhiêu

""Bạn hối tiếc vì không nắm bắt lấy một cơ hội nào đó, chẳng có ai phải mất ngủ.

Bạn trải qua những ngày tháng nhạt nhẽo với công việc bạn căm ghét, người ta chẳng hề bận lòng.

Bạn có chết mòn nơi xó tường với những ước mơ dang dở, đó không phải là việc của họ.

Suy cho cùng, quyết định là ở bạn. Muốn có điều gì hay không là tùy bạn.

Nên hãy làm những điều bạn thích. Hãy đi theo tiếng nói trái tim. Hãy sống theo cách bạn cho là mình nên sống.

Vì sau tất cả, chẳng ai quan tâm.""",70000,9,20,59000,5,,,,
