category_id,author,name,description,price,num_buy,amount,sale,star,,,,
1, Alexandre Dumas,Ba Người Lính Ngự Lâm,"Ba Người Lính Ngự Lâm là câu chuyện mở đầu trong bộ ba truyện Les trois Mousquetaires (Ba người lính ngự lâm), Vingt ans après (hai mươi năm sau) và Le Vicomte de Bragelonne (tử tước de Bragelonne).

Cuốn tiểu thuyết lấy bối cảnh là xã hội quý tộc vua chúa đầy âm mưu cả chính trị và tình ái đan xen của cung đình nước Pháp thế kỷ XVII. Nổi bật lên trên cả các bậc vua chúa đó, Dumas đặt nhân vật d’Artagnan và ba người lính ngự lâm vào trung tâm của mọi sự kiện và là những người hóa giải mọi âm mưu.

Ba người ngự lâm cùng chàng trai trẻ tài năng, ngang ngược d’Artagnan đã tạo nên một “boyband” tuyệt vời, chiến đấu cho công lý, ngăn chặn “ngòi nổ” chiến sự và giành lại những gì đã mất. Với câu khẩu hiệu “Một người vì mọi người, mọi người vì một người”, các chàng ngự lâm chuẩn bị sẵn sàng để lao vào cuộc chiến đầy hiểm nguy và kịch tính, lôi cuốn bạn đọc không thể rời mắt đến tận trang sách cuối cùng.",169000,0,10,118000,5,,,,
0,Mari Tamagawa,Mặc Kệ Thiên Hạ - Sống Như Người Nhật,"Mặc Kệ Thiên Hạ - Sống Như Người Nhật


Cuốn sách gối đầu giường cho những người hay lo lắng, sợ hãi và luôn thấy mình kém may mắn

Dành cho những ai muốn được sống là chính mình, cuộc đời của mình, tuổi trẻ của mình.

Đã đến lúc bạn nên dừng tìm kiếm sự an ủi ở người khác, hoặc chờ đợi sự giúp đỡ từ một ai đó. Bởi an ủi hay giúp đỡ về mặt cảm xúc đôi khi giống như con dao hai lưỡi. Nó có thể giúp bạn chống đỡ lo âu hay muộn phiền nhất thời, nhưng lại đẩy bạn chìm sâu hơn vào những cảm xúc tiêu cực đó. Giống như một đứa trẻ khi vấp ngã, bạn mong đợi một sự xoa dịu từ người lớn, mà quên mất rằng sự “hỗ trợ” ấy chỉ càng khiến bạn mãi chẳng thể nào “biết đi”.

Và Mặc hệ thiên hạ, sống như người Nhật chính là cuốn sách dành cho những người muốn đi bằng chính đôi chân mình. Dành cho những người muốn gạt bỏ những nỗi sợ bởi chính tay mình, chứ không cầu cứu bất kì sự trợ giúp nào.

Hãy thử sống một ngày “mặc kệ thiên hạ”, mặc kệ những lời nhận xét từ người khác. Hãy thử sống một ngày bạn cho phép mình từ bỏ, từ bỏ những thứ khó khăn, ngổn ngang lo lắng. Hãy thử sống một ngày bạn trân trọng mọi cung bậc cảm xúc bên trong con người bạn.

“Nếu bạn có thể thẳng thắn đối diện với bản thân và từ bỏ những thứ đang giam cầm bạn, bạn sẽ trở thành con người có chính kiến, biết quý trọng hơn và đặt những cảm xúc của bản thân lên trên mọi ánh nhìn của người khác.”

Mari Tamagawa khuyến khích mỗi người nên sống thật và ngưng phán xét bản thân. Thật lãng phí khi bạn để cuộc đời mình phải trải qua những tháng ngày khổ sở chỉ vì cái nhìn của người khác. Cũng đừng tin vào những “chiếc phao” cứu cánh mà bạn nhầm tưởng rằng sẽ giúp mình rũ bỏ được mọi lo lắng. Tổn thương tâm lí, áp lực hay nỗi sợ… của bản thân, chúng ta phải đối mặt với nó, chiến đấu và tự chữa trị cho chính mình.

Đã đến lúc bạn cần phải nói lời tạm biệt với cuộc sống đầy âu lo đang rút cạn năng lượng của bạn. Cuộc đời của bạn không thuộc về ai khác, cuộc đời của bạn thuộc về bạn. Tháng 3 này hãy để “Mặc kệ thiên hạ, sống như người Nhật” giúp bạn bắt đầu cuộc đời mới, cuộc đời mang tên chính mình.",79000,0,10,63000,5,,,,
2,Nguyễn Nhật Ánh,Cô gái đến từ hôm qua,"Cô Gái Đến Từ Hôm Qua

Nếu ngày xưa còn bé, Thư luôn tự hào mình là cậu con trai thông minh có quyền bắt nạt và sai khiến các cô bé cùng lứa tuổi thì giờ đây khi lớn lên, anh luôn khổ sở khi thấy mình ngu ngơ và bị con gái “xỏ mũi”. Và điều nghịch lý ấy xem ra càng “trớ trêu’ hơn, khi như một định mệnh, Thư nhận ra Việt An, cô bạn học thông minh thường làm mình bối rối bấy lâu nay chính là Tiểu Li, con bé hàng xóm ngốc nghếch từng hứng chịu những trò nghịch ngợm của mình hồi xưa.

",80000,0,10,56000,5,,,,
1,Harper Lee,Giết con chim nhại,"Giết Con Chim Nhại 

Nào, hãy mở cuốn sách này ra. Bạn phải làm quen ngay với bố Atticus của hai anh em - Jem và Scout, ông bố luật sư có một cách riêng, để những đứa trẻ của mình cứng cáp và vững vàng hơn khi đón nhận những bức xúc không sao hiểu nổi trong cuộc sống. Bạn sẽ nhớ rất lâu người đàn ông thích trốn trong nhà Boo Radley, kẻ bị đám đông coi là lập dị đã chọn một cách rất riêng để gửi những món quà nhỏ cho Jem và Scout, và khi chúng lâm nguy, đã đột nhiên xuất hiện để che chở. Và tất nhiên, bạn không thể bỏ qua anh chàng Tom Robinson, kẻ bị kết án tử hình vì tội hãm hiếp một cô gái da trắng, sự thật thà và suy nghĩ quá đỗi đơn giản của anh lại dẫn đến một cái kết hết sức đau lòng, chỉ vì lý do anh là một người da đen.

Cho dù được kể dưới góc nhìn của một cô bé, cuốn sách Giết con chim nhại không né tránh bất kỳ vấn đề nào, gai góc hay lớn lao, sâu xa hay phức tạp: nạn phân biệt chủng tộc, những định kiến khắt khe, sự trọng nam khinh nữ… Góc nhìn trẻ thơ là một dấu ấn đậm nét và cũng là đặc sắc trong Giết con chim nhại. Trong sáng, hồn nhiên và đầy cảm xúc, những câu chuyện tưởng như chẳng có gì to tát gieo vào người đọc hạt mầm yêu thương.

Gần 50 năm từ ngày đầu ra mắt, Giết con chim nhại, tác phẩm đầu tay và cũng là cuối cùng của nữ nhà văn Mỹ Harper Lee vẫn đầy sức hút với độc giả ở nhiều lứa tuổi.

Thông điệp yêu thương trải khắp các chương sách là một trong những lý do khiến Giết con chim nhại giữ sức sống lâu bền của mình trong trái tim độc giả ở nhiều quốc gia, nhiều thế hệ. Những độc giả nhí tìm cho mình các trò nghịch ngợm và cách nhìn dí dỏm về thế giới xung quanh. Người lớn lại tìm ra điều thú vị sâu xa trong tình cha con nhà Atticus, và đặc biệt là tình người trong cuộc sống, như bé Scout quả quyết nói “em nghĩ chỉ có một hạng người. Đó là người”.",108000,0,10,75600,5,,,,
3,Dr. Blair Thomas Spalding,Hành Trình Về Phương Đông,"Hành Trình Về Phương Đông

Hành Trình Về Phương Đông mở ra một chân trời mới về Đông Tây gặp nhau, để khoa học Minh triết hội ngộ, để Hiện đại Cổ xưa giao duyên, để Đất Trời là một. Thế giới, vì vậy đã trở nên hài hòa hơn, rộng mở, diệu kỳ hơn và, do đó, nhân văn hơn.

Hành Trình Về Phương Đông kể về những trải nghiệm của một đoàn khoa học gồm các chuyên gia hàng đầu của Hội Khoa Học Hoàng Gia Anh được cử sang Ấn Độ nghiên cứu về huyền học và những khả năng siêu nhiên của con người. Suốt hai năm trời rong ruổi khắp các đền chùa Ấn Độ, chúng kiến nhiều pháp luật, nhiều cảnh mê tín dị đoan, thậm chí lừa đảo...của nhiều pháp sư, đạo sĩ...họ được tiếp xúc với những vị thế, họ được chứng kiến, trải nghiệm, hiểu biết sâu sắc về các khoa học cổ xưa và bí truyền của văn hóa Ấn Độ như Yoga, thiền định, thuật chiêm duyên, nghiệp báo, luật nhân quả, cõi sống và cõi chết....

Đúng lúc một cuộc đối thoại cởi mở và chân thành đang sắp diễn ra với các đạo sĩ bậc thầy, thì đoàn nhận được tối hậu thu từ chính quyền Anh Quốc là phải ngừng ngay việc nghiên cứu, tức khắc hồi hương và bị buộc phải im lặng, không được phát ngôn về bất cứ điều gì mà họ đã chứng nghiệm. Sau cùng ba nhà khoa học trong đoàn đã chấp nhận bỏ lại tất cả sau lưng, ở lại Ấn Độ tiếp tục nghiên cứu và cuối cùng trở thành tu sĩ. Trong số đó có giáo sư Salding- tác giả hồi ký đặc biệt này.",78000,0,10,47000,5,,,,
3,Xiu-ying Wei,Bốn rưỡi sáng,"Harvard Bốn Rưỡi Sáng

Harvard bốn rưỡi sáng sử dụng hình ảnh Harvard như một biểu tượng xuyên suốt, kể lại các câu chuyện có tính cách điệu về Harvard như một phương thức nhằm thu hút bạn đọc đến với cuốn sách, để từ đó chuyển tải những chỉ dẫn, khuyến khích, gợi ý cùng thông điệp vừa thực dụng vừa bay bổngtới các bạn trẻ đang ngồi trên ghế nhà trường và chuẩn bị bước vào đời. Có nhiềuthông điệp giá trị và hữu ích mà bạn sẽ học thu hoạch được từ cuốn sách như:

Nếu không chăm chỉ, thiên tài cũng trắng tay

Nhiệt tình là sức mạnh thay đổi vận mệnh

Biết tự kiểm soát bản thân để vững bước thành công

Tri thức là vốn quý mà không kẻ trộm nào lấy được

Đừng bao giờ lãng phí thời gian vào những việc vô bổ…

“Ai cũng là người cầm lái vận mệnh của chính mình. Và tự tin chính là la bàn chỉ hướng cho con thuyền của đời người. Người ta thành công hay không, hạnh phúc hay không, điều cốt yếu nhất là có tạo lập được niềm tin vững chắc hay không?” 
--- Harvard bốn rưỡi sáng.",119000,0,10,92820,5,,,,
1,Paulo Coelho,Nhà giả kim,"Nhà Giả Kim

Tất cả những trải nghiệm trong chuyến phiêu du theo đuổi vận mệnh của mình đã giúp Santiago thấu hiểu được ý nghĩa sâu xa nhất của hạnh phúc, hòa hợp với vũ trụ và con người.

Tiểu thuyết Nhà giả kim của Paulo Coelho như một câu chuyện cổ tích giản dị, nhân ái, giàu chất thơ, thấm đẫm những minh triết huyền bí của phương Đông. Trong lần xuất bản đầu tiên tại Brazil vào năm 1988, sách chỉ bán được 900 bản. Nhưng, với số phận đặc biệt của cuốn sách dành cho toàn nhân loại, vượt ra ngoài biên giới quốc gia, Nhà giả kim đã làm rung động hàng triệu tâm hồn, trở thành một trong những cuốn sách bán chạy nhất mọi thời đại, và có thể làm thay đổi cuộc đời người đọc.

“Nhưng nhà luyện kim đan không quan tâm mấy đến những điều ấy. Ông đã từng thấy nhiều người đến rồi đi, trong khi ốc đảo và sa mạc vẫn là ốc đảo và sa mạc. Ông đã thấy vua chúa và kẻ ăn xin đi qua biển cát này, cái biển cát thường xuyên thay hình đổi dạng vì gió thổi nhưng vẫn mãi mãi là biển cát mà ông đã biết từ thuở nhỏ. Tuy vậy, tự đáy lòng mình, ông không thể không cảm thấy vui trước hạnh phúc của mỗi người lữ khách, sau bao ngày chỉ có cát vàng với trời xanh nay được thấy chà là xanh tươi hiện ra trước mắt. ‘Có thể Thượng đế tạo ra sa mạc chỉ để cho con người biết quý trọng cây chà là,’ ông nghĩ.”

- Trích Nhà giả kim",69000,0,10,55000,5,,,,
4,Tina Seelig,Nếu tôi biết được khi còn 20,"Bạn có 5 đô la và 2 giờ đồng hồ để kinh doanh. Bạn sẽ làm gì? - Đây là một trong những ví dụ minh hoạ được nhắc đến trong cuốn sách Nếu Tôi Biết Được Khi Còn 20. Trả lời cho câu hỏi này có rất nhiều cách và với mỗi cách, tác giả lại chỉ ra những bài học nhỏ thôi nhưng hữu ích.

Cuốn sách được chia thành 10 chương với những vấn đề khách nhau theo một trình tự rõ ràng.

Trong cả cuốn sách, những triết lý kinh doanh đơn giản được minh hoạ bằng những ví dụ cụ thể và sáng tạo. Những tình huống kinh doanh được đặt ra, có thành công và có cả thất bại, vấn đề là cách đối mặt với nó.

Nếu Tôi Biết Được Khi Còn 20 gần gũi với những bài học bổ ích. Ngôn từ đơn giản, dễ hiểu chuyển tải một cách trọn vẹn những hàm ý sâu sắc của tác giả.

©

Những bước ngoặt lớn của cuộc đời như rời xa giảng đường êm ả hoặc khởi đầu một sự nghiệp mới thường khiến ta nhụt chí. Phải đối mặt với một rừng những lựa chọn trong khi hiểu rằng sẽ chẳng có ai cho ta biết mình đang lựa chọn đúng hay sai thật đáng sợ. Chẳng có con đường vẽ sẵn hay công thức viết sẵn nào cho thành công, thậm chí việc quyết định mình nên bắt đầu thế nào và ở đâu cũng đã rất khó khăn rồi.

Hiểu được những khó khăn, đặc biệt của những người trẻ, trước các bước ngoặt như thế trong cuộc đời, tác giả – một doanh nhân, một giáo viên, một nhà khoa học – đã dồn tâm huyết viết nên những chia sẻ tuy nhẹ nhàng và khiêm nhường, nhưng thật sâu sắc. Những trang sách chứa đầy ví dụ thú vị, cả trong phòng học lẫn trong phòng họp, về những con người sẵn sàng phấn đấu để vượt xa các tiêu chuẩn ở mức “vừa đủ”, thách thức các giả định hay quan điểm đã thành lối mòn, không bao giờ bỏ lỡ cơ hội để vươn tới tiềm năng cao nhất, và nhờ đó đạt tới những thành công vang dội.

Thông qua quyển sách, tác giả còn muốn các độc giả, đặc biệt là độc giả trẻ, sẽ được trang bị đủ sự tự tin để biến căng thẳng thành sự hào hứng, biến thử thách thành các cơ hội, và cứ sau mỗi lần vấp ngã lại đứng lên trưởng thành hơn.

Thông điệp cốt lõi của quyển sách có thể tóm gọn như sau: “Hãy cho phép mình táo bạo và xuất sắc!”

Xem Review sách: Nếu Tôi Biết Được Khi Còn 20

",64000,0,10,45000,5,,,,
5,Dale Carnegie,Đắc nhân tâm,"Đắc Nhân Tâm - Được lòng người, là cuốn sách đưa ra các lời khuyên về cách thức cư xử, ứng xử và giao tiếp với mọi người để đạt được thành công trong cuộc sống. Gần 80 năm kể từ khi ra đời, Đắc Nhân Tâm là cuốn sách gối đầu giường của nhiều thế hệ luôn muốn hoàn thiện chính mình để vươn tới một cuộc sống tốt đẹp và thành công.

Đắc Nhân Tâm cụ thể và chi tiết với những chỉ dẫn để dẫn đạo người, để gây thiện cảm và dẫn dắt người khác,... những hướng dẫn ấy, qua thời gian, có thể không còn thích hợp trong cuộc sống hiện đại nhưng nếu người đọc có thể cảm và hiểu được những thông điệp tác giả muốn truyền đạt thì việc áp dụng nó vào cuộc sống trở nên dễ dàng và hiệu quả.

Đắc Nhân Tâm, từ một cuốn sách, hôm nay đã trở thành một danh từ để chỉ một lối sống mà ở đó con người ta cư xử linh hoạt và thấu tình đạt lý. Lý thuyết muôn thuở vẫn là những quy tắc chết, nhưng Nhân Tâm là sống, là biến đổi. Bạn hãy thử đọc ""Đắc Nhân tâm"" và tự mình chiêm nghiệm những cái đang diễn ra trong đời thực hiện hữu, chắc chắn bạn sẽ có những bài học cho riêng mình.

©

""Đắc nhân tâm"" của Dale Carnegie là quyển sách nổi tiếng nhất, bán chạy nhất  và có tầm ảnh hưởng nhất của mọi thời đại...

Sách đã được chuyển ngữ sang hầu hết các thứ tiếng trên thế giới và có mặt ở hàng trăm quốc gia. Đây là cuốn sách liên tục đứng đầu danh mục sách bán chạy nhất do thời báo NewYork Times bình chọn suốt 10 năm liền.",30000,0,10,25000,5,,,,
1,Shinkai Makoto,5 Centimet Trên Giây,"5 Centimet Trên Giây

5cm/s không chỉ là vận tốc của những cánh anh đào rơi, mà còn là vận tốc khi chúng ta lặng lẽ bước qua đời nhau, đánh mất bao cảm xúc thiết tha nhất của tình yêu.

Bằng giọng văn tinh tế, truyền cảm, 5 centimet trên giây mang đến những khắc họa mới về tâm hồn và khả năng tồn tại của cảm xúc, bắt đầu từ tình yêu trong sáng, ngọt ngào của một cô bé và cậu bé. Ba giai đoạn, ba mảnh ghép, ba ngôi kể chuyện khác nhau nhưng đều xoay quanh nhân vật nam chính, người luôn bị ám ảnh bởi kí ức và những điều đã qua…

Khác với những câu chuyện cuốn bạn chạy một mạch, truyện này khó mà đọc nhanh. Ngón tay bạn hẳn sẽ ngừng lại cả trăm lần trên mỗi trang sách. Chỉ vì một cử động rất khẽ, một câu thoại, hay một xúc cảm bất chợt có thể sẽ đánh thức những điều tưởng chừng đã ngủ quên trong tiềm thức, như ngọn đèn vừa được bật sáng trong tâm trí bạn. Và rồi có lúc nó vượt quá giới hạn chịu đựng, bạn quyết định gấp cuốn sách lại chỉ để tận hưởng chút ánh sáng từ ngọn đèn, hay đơn giản là để vết thương trong lòng mình có thời gian tự tìm xoa dịu.",50000,0,10,40000,5,,,,
4,Trác Nhã,Khéo Ăn Nói Sẽ Có Được Thiên Hạ,"Khéo Ăn Nói Sẽ Có Được Thiên Hạ

Xã hội hiện đại, từ xin việc đến thăng chức, từ tình yêu đến hôn nhân, từ giao lưu đến hợp tác… không việc gì không cần tài ăn nói.

Khéo ăn nói giống như sở hữu loại “dầu bôi trơn” đảm bảo các mối quan hệ của bạn “vận hành” trơn tru. Không khéo ăn nói, gặp chuyện nhỏ mắc trở ngại, gặp chuyện lớn vấp thất bại.

Làm thế nào để nói năng trôi chảy? Làm thế nào để nói lời “đi vào lòng người”? Trong những dịp khác nhau, với những người khác nhau, ở những tình huống không giống nhau… có cuốn sách này gợi ý, bạn sẽ thành người khéo ăn nói.",99000,0,10,69000,5,,,,
6,Paul Kalanithi,Khi Hơi Thở Hóa Thinh Không,"Khi Hơi Thở Hóa Thinh Không là tự truyện của một bác sĩ bị mắc bệnh ung thư phổi. Trong cuốn sách này, tác giả đã chia sẻ những trải nghiệm từ khi mới bắt đầu học ngành y, tiếp xúc với bệnh nhân cho tới khi phát hiện ra mình bị ung thư và phải điều trị lâu dài.

Kalanithi rất yêu thích văn chương nên câu chuyện của anh đã được thuật lại theo một phong cách mượt mà, dung dị và đầy cảm xúc. Độc giả cũng được hiểu thêm về triết lý sống, triết lý nghề y của Kalanithi, thông qua ký ức về những ngày anh còn là sinh viên, rồi thực tập, cho đến khi chính thức hành nghề phẫu thuật thần kinh. “Đối với bệnh nhân và gia đình, phẫu thuật não là sự kiện bi thảm nhất mà họ từng phải đối mặt và nó có tác động như bất kỳ một biến cố lớn lao trong đời. Trong những thời điểm nguy cấp đó, câu hỏi không chỉ đơn thuần là sống hay chết mà còn là cuộc sống nào đáng sống.” – Kalanithi luôn biết cách đưa vào câu chuyện những suy nghĩ sâu sắc và đầy sự đồng cảm như thế.

Bạn bè và gia đình đã dành tặng những lời trìu mến nhất cho con người đáng kính trọng cả về tài năng lẫn nhân cách này. Dù không thể vượt qua cơn bệnh nan y, nhưng thông điệp của tác giả sẽ còn khiến người đọc nhớ mãi.",109000,0,10,79000,5,,,,
1,Hector Malot,Không Gia Đình,"Không Gia Đình là cuốn sách được xếp vào danh mục văn học thiếu nhi nhưng rõ ràng, với những gì Không Gia Đình đã kể thì đây là cuốn sách dành cho mọi lứa tuổi ở mọi quốc gia, mọi tầng lớp.

Không Gia Đình là một chuyến phiêu lưu mà Rêmi là nhân vật chính. Em nghèo khổ, em cô độc, em không có người thân. Cuộc đời Rêmi gắn liền với gánh xiếc rong, với những thử thách mà em gặp phải trên đường đời trải rộng khắp nước Pháp tươi đẹp. Rêmi lớn lên trong đau khổ, lang thang mọi nơi, bị tù đày... nhưng dù trong hoàn cảnh nào, em vẫn đứng thẳng lưng, ngẩng cao đầu, giữ phẩm chất làm người - điều em đã học từ cụ Vitali trong cuộc đời lang bạt của mình.

Không Gia Đình ca ngợi giá trị của lao động, của nhân cách và tình cảm. Cuốn sách mô tả những hình ảnh, những mảnh đời bấp bênh để làm nền cho niềm tin, cho tình người ấm áp.

Không Gia Đình thực sự là một cuốn sách hay và giá trị hơn cả một giá sách dạy phương pháp làm người.",119000,0,10,94200,5,,,,
4,Satoshi Noguchi,Làm Chủ Giao Tiếp Để Thành Công,"Làm Chủ Giao Tiếp Để Thành Công

Giao tiếp là việc hằng ngày ai cũng phải làm, nhưng lại rất ít người trong chúng ta chịu đặt ra câu hỏi: “Giao tiếp như thế nào cho hiệu quả?”. Vì không chịu nâng cao kỹ năng đối thoại, chúng ta rất dễ thụ động trong các tình huống xã hội. VD: Khi bạn kể chuyện, người nghe dù rất chăm chú vẫn không hiểu bạn muốn nói gì. Nếu phải đứng trước đám đông phát biểu, bạn sẽ lúng túng như gà mắc tóc. Bạn rất tự tin khi gặp gỡ nhà tuyển dụng, nhưng cuối cùng lại không gây được ấn tượng nào với họ…

Việc đặt ra những câu hỏi như “Phải dùng giọng điệu thế nào cho hay?”, “Không nên nói điều gì để tránh gây nhàm chán”… chỉ mất thêm của bạn khoảng vài phút trước cuộc hội thoại nhưng lại tạo ra hiệu quả hoàn toàn khác biệt. Nếu muốn tiến bộ, hãy học hỏi và luyện tập từ những điều nhỏ nhất.

Cuốn sách “Làm chủ giao tiếp để thành công” của Satoshi Noguchi sẽ giúp bạn tìm ra các vấn đề để cải thiện kỹ năng giao tiếp và cung cấp các kỹ thuật nhằm giải quyết các vấn đề đó. Bên cạnh các lời khuyên, tác giả cũng liên tục đưa ra những ví dụ cụ thể, thực tế trong cuộc sống để độc giả dễ dàng tham khảo và áp dụng. Hãy nhớ rằng, mọi rào cản khó khăn trong khi trò chuyện đều có thể được phá vỡ. Ngưng trì hoãn, bắt đầu thay đổi và thực hành ngay hôm nay, bạn sẽ trở nên tự tin hơn rất nhiều trong lần tiếp theo phải “xử lý” các tình huống tương tác ngoài xã hội.",85000,0,10,59500,5,,,,
4,Camilo Cruz,Ngày Xưa Có Một Con Bò,Dù muốn dù không thì trong mỗi người chúng ta đều đang nuôi ít nhất là 1 con bò và thậm chí là cả đàn bò. Đó là những con bò: bao biện, viện cớ, đổ lỗi, ỷ lại, mãi tự hào với quá khứ…,62000,50000,5,2017-12-01 23:04:00,2017-12-01 23:04:00
1,John Green,Khi Lỗi Thuộc Về Những Vì Sao,"Khi Lỗi Thuộc Về Những Vì Sao

Mặc dù phép màu y học đã giúp thu hẹp khối u và ban thêm vài năm sống cho Hazel nhưng cuộc đời cô bé đang ở vào giai đoạn cuối, từng chương kế tiếp được viết theo kết quả chẩn đoán. Nhưng khi có một nhân vật điển trai tên là Augustus Waters đột nhiên xuất hiện tại Hội Tương Trợ Bệnh Nhi Ung Thư, câu chuyện của Hazel sắp được viết lại hoàn toàn.

Sâu sắc, táo bạo, ngang tàng, và thô ráp, Khi lỗi thuộc về những vì sao là tác phẩm thương tâm và tham vọng nhất của John Green, tác giả của những giải thưởng, nhưng đồng thời lại khám phá một cách khéo léo nét hài hước, li kỳ, và bi thảm của việc sống và việc yêu.",105000,0,10,74000,5,,,,
